{
  "$schema": "https://json-schema.org/draft/2020-12/schema",
  "$id": "https://contracts-spec/decision-os/verdict_artifact.schema.json",
  "title": "VerdictArtifact",
  "description": "Structured provenance for a kernel verdict. SPECIFICATION ONLY — shipping this schema does NOT mean provenance is implemented end-to-end. Epistemic rule: fields under accepted_inputs record what the kernel ASSUMED for this verdict, not verified world truth. asserted_by ≠ verified_truth; provenance_ref ≠ truth; accepted_input ≠ world_fact.",
  "type": "object",
  "additionalProperties": false,
  "required": [
    "artifact_version",
    "decision_id",
    "verdict",
    "kernel_version",
    "constitution_version",
    "accepted_inputs",
    "constitutional_basis",
    "inference_trace",
    "epistemic_disclaimer"
  ],
  "properties": {
    "artifact_version": {
      "type": "string",
      "pattern": "^[0-9]+\\.[0-9]+\\.[0-9]+$",
      "description": "Schema version of this artifact (semver)."
    },
    "decision_id": {
      "type": "string",
      "minLength": 1,
      "description": "Stable identifier for this verdict instance (UUID or content hash)."
    },
    "verdict": {
      "type": "string",
      "enum": ["ALLOW", "DENY", "LIMIT", "CONTAIN", "DEFER"],
      "description": "Final kernel verdict. Same enum as decision.schema.json."
    },
    "kernel_version": {
      "type": "string",
      "minLength": 1,
      "description": "Version of the decision kernel that produced this artifact."
    },
    "constitution_version": {
      "type": "string",
      "minLength": 1,
      "description": "Frozen axiom set identifier (e.g. fdk-v1.0-a1-a7). NOT a claim that the constitution is morally correct."
    },
    "accepted_inputs": {
      "type": "array",
      "minItems": 0,
      "description": "Facts the kernel treated as given for this verdict. Each entry is an ASSUMPTION, not verified truth.",
      "items": { "$ref": "#/$defs/AcceptedInput" }
    },
    "constitutional_basis": {
      "$ref": "#/$defs/ConstitutionalBasis",
      "description": "Which frozen axioms grounded this verdict."
    },
    "inference_trace": {
      "$ref": "#/$defs/InferenceTrace",
      "description": "Ordered rule IDs applied during inference. rule_id refers to registry entries, not implicit code order."
    },
    "authority_context_ref": {
      "type": ["string", "null"],
      "default": null,
      "description": "Optional reference to authority grant / capability context (Track A). Null when verdict is moral-only or pre-authority."
    },
    "action_ref": {
      "type": ["string", "null"],
      "default": null,
      "description": "Binds verdict to the action content (nonce or hash). Aligns with decision.schema.json action_ref."
    },
    "input_hash": {
      "type": ["string", "null"],
      "default": null,
      "description": "Hash of the normalized input bundle used for this verdict (reproducibility)."
    },
    "signature": {
      "type": ["string", "null"],
      "default": null,
      "description": "Optional Ed25519 (or other) signature over canonical artifact bytes. Null in specification-only / pre-implementation artifacts."
    },
    "epistemic_disclaimer": {
      "const": "This artifact records constitutional behavior conditional on accepted_inputs. It does not certify that accepted inputs match world truth.",
      "description": "Mandatory disclaimer — parsers MUST preserve this field."
    }
  },
  "$defs": {
    "AcceptedInput": {
      "type": "object",
      "additionalProperties": false,
      "required": ["fact_key", "fact_value", "asserted_by", "input_class"],
      "properties": {
        "fact_key": {
          "type": "string",
          "minLength": 1,
          "description": "Stable key (e.g. coerces, actor.is_machine, consent.valid)."
        },
        "fact_value": {
          "description": "Value assumed for this verdict. Typed per fact_key registry."
        },
        "asserted_by": {
          "type": "string",
          "minLength": 1,
          "description": "WHO supplied this fact (principal, plugin, caller). asserted_by ≠ verified_truth."
        },
        "input_class": {
          "type": "string",
          "enum": ["CALLER_FLAG", "TYPED_FACT", "ATTESTED", "PLUGIN", "UNKNOWN"],
          "description": "How the fact entered the kernel. ATTESTED does not mean morally true — only that an attestation chain exists (when implemented)."
        },
        "provenance_ref": {
          "type": ["string", "null"],
          "default": null,
          "description": "Optional URI/hash to attestation log or source record. provenance_ref ≠ truth."
        },
        "accepted_at": {
          "type": ["string", "null"],
          "format": "date-time",
          "default": null,
          "description": "When the kernel accepted this input for this verdict."
        }
      }
    },
    "ConstitutionalBasis": {
      "type": "object",
      "additionalProperties": false,
      "required": ["axiom_ids"],
      "properties": {
        "axiom_ids": {
          "type": "array",
          "minItems": 1,
          "items": {
            "type": "string",
            "pattern": "^(A[1-7]|C[1-7]|R0)$"
          },
          "description": "Frozen axiom IDs from AXIOM_REGISTRY (e.g. A4, C1). References normative layer, not moral proof."
        },
        "derived_principle_ids": {
          "type": "array",
          "items": { "type": "string" },
          "default": [],
          "description": "Optional derived principle IDs (C1–C7) when distinct from axiom_ids."
        }
      }
    },
    "InferenceTrace": {
      "type": "object",
      "additionalProperties": false,
      "required": ["rule_ids"],
      "properties": {
        "rule_ids": {
          "type": "array",
          "minItems": 1,
          "items": {
            "type": "string",
            "minLength": 1,
            "description": "Stable rule identifier (e.g. kernel.a4.ownerless_machine, kernel.forbidden.coerces)."
          },
          "description": "Ordered list of calculus rules fired. Must map to AXIOM_REGISTRY / code registry when implemented."
        },
        "defer_reason": {
          "type": ["string", "null"],
          "default": null,
          "description": "When verdict=DEFER, why inference could not complete."
        }
      }
    }
  }
}
